<?xml version="1.0"?>
<!DOCTYPE robot SYSTEM "robot.dtd">
<robot>
   
<!-- ====================================================
	 NavX
	 ==================================================== -->    
	<navx orientation="0"
	      porttype="0"
	      portid="4" />    
    
<!-- ====================================================
	 Pigeon
	 ==================================================== -->    
    <pigeon canId="40" />
       
<!-- ====================================================
	 PCM
	 ==================================================== -->    
	<pcm canId="13" />
       
<!-- ====================================================
	 PDP
	 ==================================================== -->    
	<pdp canId="10" />
    
<!-- ====================================================
	 LEDs
	 ==================================================== -->    
	<led canId="30" />
       
<!-- ====================================================
	 Chassis
	 ====================================================  -->
    <chassis type="0"
    		 wheelDiameter="6.363"
             wheelBase="25.0"  
             track="18.0">
             
 		<!-- right back 11-->
        <motor usage="11"
        	   canId="2"
         	   feedbackDevice="0"
         	   countsPerRev="128"
        	   gearRatio="11.0/18.0" />
		<!-- left back 8-->
        <motor usage="8"
               canId="3"
               inverted="true"
        	   feedbackDevice="0"
          	   countsPerRev="128"
        	   gearRatio="11.0/18.0" />            
		<!-- right front 12-->
        <motor usage="12"
        	   canId="0"
        	   feedbackDevice="0"
         	   countsPerRev="128"
        	   gearRatio="11.0/18.0"
        	   slaveTo="2" />
		<!-- left front 9 -->
        <motor usage="9"
               canId="1"
               inverted="true"
         	   feedbackDevice="0"
          	   countsPerRev="128"
        	   gearRatio="11.0/18.0" 
        	   slaveTo="3" />

               
    </chassis> 

</robot>

